Provider,National Council of Teacher of English
Package Identifier,national_council_of_teacher_of_english_master_2014
Package Name,National Council of Teacher of English:Master
Agreement Term Start Year,01/01/2014
Agreement Term End Year,01/01/2100
Consortium,""
publication_title,ID.issn,ID.eissn,date_first_issue_online,num_first_vol_online,num_first_issue_online,date_last_issue_online,num_last_vol_online,num_last_issue_online,embargo_info,coverage_depth,coverage_notes,publisher_name,ID.doi,platform.host.name,platform.host.url,platform.administrative.name,platform.administrative.url,hybrid_oa,access_start_date,access_end_date
English Education,0007-8204,,,,,,,,,fulltext,,,,National Council of Teacher of English,http://demo.kbplus.ac.uk/kbplus/noHostPlatformUrl,,,,,
Research in the Teaching of English,0034-527X,,,,,,,,,fulltext,,,,National Council of Teacher of English,http://demo.kbplus.ac.uk/kbplus/noHostPlatformUrl,,,,,
